ID,Name,Description,Price,Quantity
201,67EI5Jnz,Cost-effective Eco-Friendly Efficient Innovative Durable,727.1,12
202,zcs2alIv,Efficient Advanced Versatile Advanced Advanced,814.02,896
203,cYGP2Glm,Versatile Durable Efficient Eco-Friendly Compact,916.15,937
204,UZv03ePr,Compact Portable High-Quality Cost-effective Eco-Friendly,530.25,114
205,BijQ4o3x,Portable Efficient Portable High-Quality High-Quality,470.59,352
206,oVhtVOxT,Advanced Efficient Compact Innovative Eco-Friendly,563.76,218
207,Zukun4HT,Cost-effective Efficient Durable Advanced Portable,237.31,122
208,ermu0PVs,Compact Advanced Efficient Efficient Versatile,185.6,860
209,eOGCR2IN,High-Quality Efficient Eco-Friendly Efficient Eco-Friendly,694.27,355
210,MhJ8dua5,Compact Durable Eco-Friendly Versatile Eco-Friendly,104.46,594
211,BngsGCfc,Portable Durable Advanced Cost-effective Durable,235.66,661
212,GdUj3JMZ,Versatile Compact Compact Compact Portable,99.92,820
213,PbQrDRy4,Durable Efficient Efficient Innovative Advanced,411.91,166
214,ZKAYe4d4,Durable Innovative Cost-effective Portable Advanced,474.1,225
215,IyiI2Z7r,Advanced Eco-Friendly Compact Cost-effective Durable,303.05,771
216,l1d3sTVG,Durable Compact Innovative Efficient Eco-Friendly,915.9,453
217,ON3BXs2A,Durable Durable Advanced Cost-effective Portable,60.8,806
218,WoqsHjnN,Portable Advanced Innovative Durable Eco-Friendly,398.92,211
219,BRBLX6tr,Compact Advanced Compact Durable Advanced,390.66,484
220,OGLLQcsg,Cost-effective Efficient Innovative Cost-effective Compact,540.03,523
221,RfzGkej6,Eco-Friendly Durable Durable Compact Innovative,543.88,918
222,zKTYhMWu,Advanced Innovative Advanced Durable Innovative,541.84,114
223,9OFeuhvt,Advanced Efficient Durable Cost-effective Advanced,184.35,576
224,sZJO6m81,Eco-Friendly Compact Durable Durable Efficient,237.97,930
225,huxfB11D,Compact High-Quality Eco-Friendly Durable Cost-effective,239.43,84
226,pTiJREMm,Efficient Durable Innovative High-Quality Advanced,843.63,327
227,DNMTQU35,Compact Innovative Innovative Portable Cost-effective,688.47,61
228,g7ox7SJZ,Versatile Efficient Cost-effective Versatile Eco-Friendly,500.97,543
229,4RfwrFus,High-Quality Portable Efficient Cost-effective Compact,460.21,917
230,EZrPEG7I,Durable Versatile High-Quality Advanced Portable,887.39,497
231,7y4Fty99,Innovative Advanced Eco-Friendly Versatile Compact,645.07,731
232,rZbTNwBn,Compact Cost-effective Cost-effective Eco-Friendly Efficient,449.82,176
233,a7aa3iwz,Portable Advanced Compact Compact Innovative,921.65,41
234,EczrUCT3,Portable Portable Compact High-Quality Cost-effective,757.9,411
235,hARF8Xav,Durable Innovative Compact Versatile Innovative,581.03,462
236,a5RPjLR4,Compact Cost-effective Durable Cost-effective Compact,669.13,958
237,Jnzj7QGt,Cost-effective Durable Portable Advanced Durable,448.08,357
238,OYeUPxIx,Durable Cost-effective Eco-Friendly High-Quality Cost-effective,463.19,810
239,VFHlN1xo,Innovative Versatile Cost-effective High-Quality Innovative,963.3,760
240,22whdrFm,Advanced Portable Advanced Versatile Compact,543.22,954
241,5FTHR47x,Compact Compact Efficient Versatile Eco-Friendly,996.22,834
242,S03QvvcE,Advanced Innovative Durable Advanced Cost-effective,340.26,220
243,SlGEuzgb,High-Quality High-Quality Portable Versatile High-Quality,143.05,984
244,gCDvd2Bn,Innovative Compact Eco-Friendly Cost-effective Compact,231.02,347
245,Xz98Wf32,Compact Advanced Efficient Versatile Eco-Friendly,579.94,793
246,wHnhldAP,High-Quality Cost-effective Efficient Portable High-Quality,190.03,843
247,ZVOLF5JG,Eco-Friendly Efficient Durable Cost-effective Compact,21.83,102
248,F8Tgj49r,Durable Portable Compact Efficient Cost-effective,15.71,694
249,TNyW5bRY,Portable Portable Portable Eco-Friendly Efficient,324.67,348
250,Gnnm9h5O,Versatile Versatile Cost-effective Efficient Advanced,216.72,61
251,TAnPibjV,Compact Cost-effective Advanced Versatile Compact,563.22,101
252,3XGptUHo,High-Quality Advanced High-Quality Durable Advanced,471.92,604
253,aXqNr7TM,Versatile Compact Eco-Friendly Versatile Durable,558.0,467
254,zyNOHtTr,Efficient Efficient Efficient Versatile Portable,427.62,112
255,IFNndxZb,Portable Eco-Friendly Cost-effective Cost-effective Innovative,231.22,258
256,ZaOKkgxF,Versatile Versatile Innovative Versatile Innovative,788.9,966
257,eHr4UKC4,Portable Cost-effective High-Quality Versatile Compact,622.2,412
258,O7vK3mGH,Versatile Durable Compact Innovative Advanced,47.46,323
259,R6pLG5ht,Innovative Eco-Friendly Versatile Innovative Compact,158.84,473
260,12dT02Pz,Compact Eco-Friendly High-Quality Durable Advanced,505.13,700
261,hr9mCWEw,Portable Durable Durable High-Quality High-Quality,421.96,225
262,ffKdxrcr,Compact Cost-effective Eco-Friendly Cost-effective Compact,633.01,826
263,oVzHmzU2,Eco-Friendly Versatile Advanced Portable Compact,995.77,989
264,Pv4TEDo5,Efficient Versatile Innovative Compact High-Quality,59.25,184
265,1ZaGRM4V,Versatile Compact Innovative Durable Versatile,89.16,634
266,SXq9dSjX,Advanced Efficient Efficient Cost-effective Eco-Friendly,703.69,608
267,pWQ7mcsE,Innovative Portable High-Quality Advanced Innovative,933.01,685
268,xAzgmrW0,Portable Cost-effective Eco-Friendly Efficient Cost-effective,938.1,813
269,Plzyxi0m,Versatile Portable High-Quality Cost-effective Advanced,928.63,474
270,OcXThnJ3,Versatile High-Quality Advanced Cost-effective Eco-Friendly,770.42,434
271,q0yXPvmK,High-Quality Versatile Compact Eco-Friendly Cost-effective,407.81,833
272,uee7OXBV,Eco-Friendly Versatile High-Quality Versatile Versatile,342.65,180
273,1sKJ7Kew,High-Quality Advanced Cost-effective Efficient Advanced,430.15,526
274,TeRt9sXU,Durable Durable Portable Efficient Compact,610.51,393
275,IMFUeu4k,Efficient Portable Efficient Portable Versatile,749.84,497
276,NHRQTi5T,Compact Versatile Durable Versatile Durable,396.9,357
277,8ADeTg3d,Durable Efficient Versatile Innovative Innovative,254.48,183
278,WbMAtrZI,Innovative Durable Portable Durable Versatile,499.85,623
279,MdrRhKq7,Advanced Eco-Friendly Portable Portable Versatile,976.06,925
280,puJQgpQv,Efficient Efficient Portable Versatile Versatile,361.97,277
281,dFRK0AeN,Eco-Friendly Versatile Durable Eco-Friendly Cost-effective,186.67,611
282,dpac29w4,Efficient Compact High-Quality Advanced Advanced,661.25,476
283,eznOVzQ8,Portable Durable High-Quality Portable Durable,749.85,293
284,8fWQJovE,High-Quality Eco-Friendly Compact Advanced Cost-effective,453.32,632
285,D3kpG1HU,Eco-Friendly Cost-effective Compact Compact Advanced,256.54,772
286,O3TL1LJr,Cost-effective Cost-effective Innovative Versatile Portable,481.93,413
287,j6FC3RNk,Eco-Friendly Versatile High-Quality Innovative Durable,996.05,639
288,7wW1tKku,Innovative Portable Durable Portable Efficient,487.23,746
289,1XTg29qO,Cost-effective Durable Durable High-Quality Versatile,822.58,945
290,Ytzkzw4t,Cost-effective Cost-effective Portable Compact Durable,668.04,399
291,VebdgGbQ,Eco-Friendly Versatile Cost-effective Cost-effective Compact,695.78,986
292,UGlCsJBX,Efficient Eco-Friendly Portable Versatile High-Quality,809.99,785
293,HUkMtlPB,Versatile Cost-effective Advanced Efficient Eco-Friendly,936.62,187
294,HE0cF4vY,High-Quality Advanced High-Quality High-Quality Versatile,428.25,318
295,iY7ZM4Td,Innovative Durable Advanced Innovative Compact,274.2,368
296,euzML21y,Eco-Friendly Innovative Compact High-Quality Compact,525.31,725
297,dsl6E42g,Efficient Efficient Innovative Compact Advanced,883.11,319
298,BZNWH9cb,Durable Compact Cost-effective Advanced Portable,749.15,911
299,F3FDsFLU,High-Quality Versatile Eco-Friendly Efficient Efficient,332.28,932
111,111,111,1.0,1
